{
  "protocol_version": "runtime-contract.v1",
  "schema_version": "tool-approval.v1",
  "document_type": "tool-approval",
  "kind": "REQUEST",
  "run_id": "run-1",
  "pending_journal_head": {
    "journal_revision": 4,
    "sequence": 4,
    "entry_hash": "sha256:cccccccccccccccccccccccccccccccccccccccccccccccccccccccccccccccc"
  },
  "execution_request_hash": "sha256:2222222222222222222222222222222222222222222222222222222222222222",
  "agent_definition": {
    "document_type": "agent-definition",
    "artifact_id": "worker-agent",
    "revision": 1,
    "hash": "sha256:bbbbbbbbbbbbbbbbbbbbbbbbbbbbbbbbbbbbbbbbbbbbbbbbbbbbbbbbbbbbbbbb"
  },
  "task_contract": {
    "document_type": "task-contract",
    "artifact_id": "TASK-001",
    "revision": 1,
    "hash": "sha256:aaaaaaaaaaaaaaaaaaaaaaaaaaaaaaaaaaaaaaaaaaaaaaaaaaaaaaaaaaaaaaaa"
  },
  "role": "worker",
  "profile": {
    "document_type": "mcp-profile",
    "artifact_id": "engineering-readonly",
    "revision": 1,
    "hash": "sha256:b24375aac9dd709f7c7c6848fbe8f3bf0faf062d8c17e0eb0b766e357a4a3451"
  },
  "discovery_snapshot_hash": "sha256:dddddddddddddddddddddddddddddddddddddddddddddddddddddddddddddddd",
  "server_id": "github",
  "alias": "repo.create",
  "native_name": "create_repository",
  "input_schema_hash": "sha256:eeeeeeeeeeeeeeeeeeeeeeeeeeeeeeeeeeeeeeeeeeeeeeeeeeeeeeeeeeeeeeee",
  "output_schema_hash": "sha256:ffffffffffffffffffffffffffffffffffffffffffffffffffffffffffffffff",
  "operation_class": "reversible-write",
  "logical_input_hash": "sha256:4444444444444444444444444444444444444444444444444444444444444444",
  "call_id": "tool-call-1",
  "idempotency_key": "sha256:1111111111111111111111111111111111111111111111111111111111111111",
  "summary": "Create repository redacted-name",
  "decision": null,
  "trace": {
    "trace_id": "11111111111111111111111111111111",
    "span_id": "2222222222222222",
    "trace_flags": 1
  },
  "document_hash": "sha256:aa8a4779fda72435ec3cf1c5c197a61c95e5f5a8c5f1e37320ec4797df66d362"
}
